<?xml version="1.0" encoding="UTF-8"?>
<cabinet
    xmlns="http://www.ujf-grenoble.fr/l3miage/medical"
    xmlns:xsi='http://www.w3.org/2001/XMLSchema-instance'
    xsi:schemaLocation='http://www.ujf-grenoble.fr/l3miage/medical cabinet.xsd'
>
    <nom>Soins à Grenoble</nom>
    <adresse>
        <numéro>60</numéro>
        <rue>rue de la Chimie</rue>
        <ville>Grenoble</ville>
        <codePostal>38041</codePostal>
    </adresse>
    <infirmiers>
        <infirmier id="001">
            <nom>Fréchie</nom>
            <prénom>Sarah</prénom>
            <photo>sarah.jpg</photo>
        </infirmier>
        <infirmier id="002">
            <nom>Stické</nom>
            <prénom>Sophie</prénom>
            <photo>sophie.jpg</photo>
        </infirmier>
        <infirmier id="003">
            <nom>Ochon</nom>
            <prénom>Paul</prénom>
            <photo>paul.jpg</photo>
        </infirmier>
    </infirmiers>
    <patients>
        <patient>
            <!-- Homme, né en août 98 en France, à Marseille (n°55 Bouches-du-Rhône), 458e naissance -->
            <nom>Alécole</nom>
            <prénom>Yvon</prénom>
            <sexe>M</sexe>
            <naissance>1998-08-02</naissance>
            <numéro>198081305545892</numéro>
            <adresse>
                <étage>6</étage>
                <numéro>50</numéro>
                <rue>avenue Félix Viallet</rue>
                <ville>Grenoble</ville>
                <codePostal>38031</codePostal>
            </adresse>
            <visite date="2015-12-08" intervenant="001">
                <acte id="109"/>
            </visite>
            <visite date="2016-01-05" intervenant="004">
                <acte id="110"/>
            </visite>
        </patient>
        <patient>
            <!-- Elvire est née le 08 mars 82 en France, à Lyon (n° 23 dans le rhône), il s'agissait de la 52e naissance dans cette ville -->
            <nom>Orouge</nom>
            <prénom>Elvire</prénom>
            <sexe>F</sexe>
            <naissance>1982-03-08</naissance>
            <numéro>282036902305218</numéro>
            <adresse>
                <rue>rond-point de la Croix de Vie</rue>
                <ville>La Tronche</ville>
                <codePostal>38700</codePostal>
            </adresse>
            <visite date="2015-12-08" intervenant="001">
                <acte id="300">Pansement de brûlure étendue</acte>
            </visite>
            <visite date="2015-12-15" intervenant="002">
                <acte id="300">Réfection du pansement de brûlure</acte>
            </visite>
            <visite date="2015-12-22" intervenant="001">
                <acte id="300">Réfection éventuelle du pansement de brûlure</acte>
            </visite>
        </patient>
        <patient>
            <!-- Oscare est née le 25 mars 75 en France, à Chambéry (n° 65 dans la Savoie) Il s'agissait de la 692e naissance. -->
            <nom>Pien</nom>
            <prénom>Oscare</prénom>
            <sexe>F</sexe>
            <naissance>1975-03-25</naissance>
            <numéro>275037306569202</numéro>
            <adresse>
                <rue>rue Casimir Brenier</rue>
                <ville>Grenoble</ville>
                <codePostal>38000</codePostal>
            </adresse>
            <visite date="2015-12-08"  intervenant="003">
                <acte id="101">Prélèvement par ponction veineuse directe</acte>
                <acte id="105">Injection intraveineuse directe isolée d'anthalgiques</acte>
            </visite>
            <visite date="2016-01-08"  intervenant="004">
                <acte id="101"/>
            </visite>
        </patient>
        <patient>
            <!-- Xavier est un petit garçon de 4 ans, né le 02 août 2011 en France, à Bordeaux (n° 63 dans la Gironde). Il s'agit de la 35e naissance. -->
            <nom>Kapoëtla</nom>
            <prénom>Xavier</prénom>
            <sexe>M</sexe>
            <naissance>2011-08-02</naissance>
            <numéro>111083306303521</numéro>
            <adresse>
                <numéro>25</numéro>
                <rue>rue des Martyrs</rue>
                <ville>Grenoble</ville>
                <codePostal>38042</codePostal>
            </adresse>
            <visite date="2015-12-15" intervenant="001">
                <acte id="111">Injection de plusieurs allergènes afin d'être désensibilisé</acte>
            </visite>
            <visite date="2016-02-29" intervenant="002">
                <acte id="402"/>
            </visite>
        </patient>
    </patients>
</cabinet>
